{
  "$schema": "../../packages/tokens/identity.schema.json",
  "id": "release-desk",
  "name": "Release Desk",
  "mark": { "type": "monogram", "text": "RD" },
  "accent": { "hue": 235 },
  "neutralBias": "neutral",
  "signature": "stage-rail",
  "shell": "sidebar",
  "density": "comfortable",
  "displayFont": "pretendard",
  "chart": "accent-sequential",
  "tone": "procedural"
}
