{
  "$schema": "../../packages/tokens/identity.schema.json",
  "id": "job-monitor",
  "name": "Job Monitor",
  "mark": { "type": "monogram", "text": "JM" },
  "accent": { "hue": 195 },
  "neutralBias": "cool",
  "signature": "status-strip",
  "shell": "sidebar",
  "density": "comfortable",
  "displayFont": "pretendard",
  "chart": "accent-sequential",
  "tone": "terse"
}
