{
  "$schema": "../../packages/tokens/identity.schema.json",
  "id": "dataset-explorer",
  "name": "Dataset Explorer",
  "mark": { "type": "icon", "icon": "layout-grid" },
  "accent": { "hue": 310 },
  "neutralBias": "warm",
  "signature": "search-hero",
  "shell": "sidebar",
  "density": "comfortable",
  "displayFont": "pretendard",
  "chart": "categorical",
  "tone": "friendly"
}
